,Pillar,Type,Text
21,Salat,Hadith," Anas b. Sirin reported:                      I asked Ibn 'Umar to tell me about the practice of the Holy Prophet (may peace be upon him) in regard to two rak'ahs before the dawn prayer: Should I make lengthy recitation in them? He said: The Messenger of Allah (may peace be upon him) used to observe, the night prayer in pairs and then made the number odd by observing one rak'ah. I said: I am not asking you about it. He said: You are a bulky man, will you not show me the patience to narrate to you the hadith completely? The Messenger of Allah (may peace be upon him) used to observe the night prayer in pairs and then made the number odd by observing one rak'ah, and then he observed two rak'ahs before dawn quite close to the call for prayer (Khalaf said:"" Did you see [yourself the Holy Prophet observing] the two rak'ahs before the dawn?"" and he made no mention of prayer.)"
22,Salat,Hadith," This hadith has been transmitted thus by 'Umar b. Khattab (with a slight change of words):                     "" I heard Hisham b. Hakim reciting Surah al-Furqan during the lifetime of Allah's Messenger (may peace be upon him)."" The rest is the same but with this addition:"" I was about to catch hold of him in prayer, but I exercised patience till he pronounced salutation."
23,Salat,Hadith," Narrated 'Aishah:                     ""What was said about me had been said, and I myself was unaware of it, the Messenger of Allah () got up and addressed the people. He recited the Tashahhud and after praising and expressing gratitude to Allah, as He deserved, he said: 'To proceed: O people! Give me your opinion regarding those people who made a forged story against my wife. By Allah, I do not know anything bad about her at all. By Allah, they accused her of being with a man about whom I have never known anything bad, and he never entered my house unless I was present there, and whenever I went on a journey, he went with me.' Sa'd bin Mu'adh [may Allah be pleased with him] got up and said: 'O Messenger of Allah ()! Allow me to chop their heads off!' Then a man from Al-Khazraj, to whom the mother of Hassan bin Thabit was a relative, got up and said (to Sa'd): 'You have told a lie! By Allah, if those persons were from Al-Aws, you would not like to chop their heads.' It was probable that some evil would take place between Aws and Khazraj in the Masjid while I was unaware of that. In the evening of that day, I went out for some of my needs, and Umm Mistah was accompanying me. On our return, Umm Mistah stumbled and said: 'Let Mistah be ruined!' I said to her, 'O mother! Why do you abuse your son?' On that Umm Mistah became silent for a while, and stumbling again, she said: 'Let Mistah be ruined!' I said to her: 'O mother! Why do you abuse your son?' She stumbled for the third time and said: 'Let Mistah be ruined!' I said to her: 'O mother! Why do you abuse your son?' Upon that she said: 'By Allah! I do not abuse him except because of you.' I asked her: 'Concerning what of my affairs?' So she disclosed the whole story to me. I said: 'Has this really happened?' She replied: 'Yes, by Allah!' I returned to my house, so astonished, that I did not know for what purpose I had gone out. Then I became sick and said to the Messenger of Allah () 'Send me to my father's house.' So he sent a servant with me, and when I entered the house, I found Umm Ruman downstairs, while Abu Bakr was reciting something upstairs. My mother asked: 'What has brought you, O daughter?' She said: ""I informed her and mentioned the whole story to her, but she did not feel as I did about it. She said: 'O my daughter! Do not worry much about this matter, for there is never a charming lady loved by her husband who has other wives, but that they feel jealous of her and speak badly of her.' But she did not feel the same about it as I did. I asked her: 'Does my father know about it?' She said 'Yes.' I asked: 'Does the Messenger of Allah () know about it too?' She said 'Yes, the Messenger of Allah () also knows about it.' Tears filled my eyes and I wept. Abu Bakr, who was reading upstairs, heard my voice, and came down asking my mother: 'What is the matter with her?' She said: 'She has heard what has been said about her.' On that Abu Bakr wept and said: 'I beseech you, by Allah, O my daughter, to go back to your home.' I went back to my home, and the Messenger of Allah () had come to my house asking my maid-servant about me. The maid-servant said: 'By Allah! I do not know of any fault or defect in her character except that she sleeps and lets the sheep enter and eat her dough.' On that, some of the Prophet's Companions spoke harshly to her and said: 'Tell the truth to the Messenger of Allah ().' Finally, they told her of the slander and she said: 'Subhan Allah! By Allah, I know nothing against her except what a goldsmith knows about a piece of pure gold.' Then this news reached the man who was accused, and he said: 'Subhan Allah! By Allah, I have never uncovered the private parts of any woman.' Later, that man was martyred in Allah's Cause. Then the next morning, my parents came to pay me a visit and they stayed with me until the Messenger of Allah () came to me, after he performed the 'Asr prayer. He came to me and while my parents were sitting around me on my right and my left. The Prophet () said the Tashahhud, praised and glorified Allah and said: 'Now then, O 'Aishah! If you have committed a bad deed, or you have wronged (yourself), then repent to Allah, as Allah accepts the repentance from His worshipers.' An Ansari woman had come and was sitting near the gate. I said to the Prophet (): 'Isn't it improper that you speak in such a way in the presence of this lady?' The Messenger of Allah () then gave a piece of advice and I turned to my father and requested him to reply to him. My father said: 'What should I say?' Then I turned to my mother and asked her to answer him. She said: 'What should I say?' When my parents did not reply to the Prophet (), I said the Tashahhud, praised and glorified Allah as His due, and I said: 'Then, by Allah! If I were to tell you that I have not done (this) and Allah, the Mighty and Sublime, is witness that I am telling the truth, that would not be of any use to me on your part, because you (people) have spoken about it and your hearts have absorbed it (as truth); and if I were to tell you that I have done this sin, and Allah knows that I have not done it, then you will say: 'She has confessed her guilt.' By Allah! I do not see a suitable example for me and you except the example of - and I could not remember Ya'qbus name - Yusuf's father when he said: So patience is most fitting. And it is Allah Whose help can be sought against that which you describe (12:18). She said: ""It was at that time that Revelation came to the Messenger of Allah (), and we remained silent. Then the Revelation was over, and I noticed the signs of happiness on his face while he was wiping (the sweat) from his forehead, and saying: 'Have the good tidings O 'Aishah! Allah has revealed your innocence.' At that time I was extremely angry. My parents said to me: 'Get up and go to him.' I said: 'By Allah, I will not do it,and will not thank him nor either of you, but I will thank Allah, Who has revealed my innocence. You have heard (this story) but neither of you have denied it, nor have you changed it (to defend me).'"" 'Aishah used to say: ""But as regards to Zainab bint Jahsh, Allah protected her because of her piety. She did not say anything except good (about me). But her sister, Hamnah was ruined among those who were ruined. Those who used to speak evil about me were Mistah, Hassan bin Thabit, and the hypocrite 'Abdullah bin Ubayy [bin Salul] and [it is he who] used to spread that news and tempt others to speak of it, and it was he and Hamnah who had the greater share therein. Abu Bakr took an oath that he would never do any favor for Mistah at all. Then Allah, Most High, revealed this Ayah: 'Let not those among you who are blessed with graces and wealth' [until the end of the Ayah] referring to Abu Bakr: 'to give their kinsmen, the poor, and those who left their homes for Allah's Cause.' - meaning Mistah - up to His saying: Do you not love that Allah should forgive you? And Allah is Oft-Forgiving, Most Merciful (24:22).' On that, Abu Bakr said: 'Yes, by Allah! O our Lord! We wish that You forgive us.' So he returned to what he had been doing."""
24,Salat,Hadith," Abu Malik Al-Ashari narrated that the Messenger of Allah said:                     Al-Wudu is half of faith, and All praise is due to Allah (Al-Hamdulillah) fills the Scale, and Glory is to Allah and all praise is to Allah (Subhan Allah Wal-Hamdulillah) fill - or - fills what is between the heavens and the earth, and Salat is light and charity is an evidence, and patience is an illumination, and the Quran is a proof for you or against you. And all people shall come to the morning selling their souls, either setting it free or destroying it."
25,Salat,Hadith," It was narrated from Abu Malik Ash'ari that:                     The Messenger of Allah said: ""Performing ablution properly is half of faith, saying Al-Hamdu Lillah fills the Scale (of good deeds), saying Subhan-Allah and Allahu Akbar fills the heavens and the earth, prayer is light, Zakat is proof, patience is brightness and the Qur'an is proof for you or against you. Every person goes out in the morning to sell his soul, so he either frees it or destroys it.'"""
26,Zakat,Hadith," Yazid b. Hayyan reported, I went along with Husain b. Sabra and 'Umar b. Muslim to Zaid b. Arqam and, as we sat by his side, Husain said to him:                      Zaid. you have been able to acquire a great virtue that you saw Allah's Messenger (may peace be upon him) listened to his talk, fought by his side in (different) battles, offered prayer behind me. Zaid, you have in fact earned a great virtue. Zaid, narrate to us what you heard from Allah's Messenger (may peace be upon him). He said: I have grown old and have almost spent my age and I have forgotten some of the things which I remembered in connection with Allah's Messenger (may peace be upon him), so accept whatever I narrate to you, and which I do not narrate do not compel me to do that. He then said: One day Allah's Messenger (may peace be upon him) stood up to deliver sermon at a watering place known as Khumm situated between Mecca and Medina. He praised Allah, extolled Him and delivered the sermon and. exhorted (us) and said: Now to our purpose. O people, I am a human being. I am about to receive a messenger (the angel of death) from my Lord and I, in response to Allah's call, (would bid good-bye to you), but I am leaving among you two weighty things: the one being the Book of Allah in which there is right guidance and light, so hold fast to the Book of Allah and adhere to it. He exhorted (us) (to hold fast) to the Book of Allah and then said: The second are the members of my household I remind you (of your duties) to the members of my family. He (Husain) said to Zaid: Who are the members of his household? Aren't his wives the members of his family? Thereupon he said: His wives are the members of his family (but here) the members of his family are those for whom acceptance of Zakat is forbidden. And he said: Who are they? Thereupon he said: 'Ali and the offspring of 'Ali, 'Aqil and the offspring of 'Aqil and the offspring of Ja'far and the offspring of 'Abbas. Husain said: These are those for whom the acceptance of Zakat is forbidden. Zaid said: Yes."
27,Zakat,Hadith," Narrated `Aisha:                     Whenever Allah's Apostle intended to go on a journey, he used to draw lots amongst his wives, and Allah's Apostle used to take with him the one on whom lot fell. He drew lots amongst us during one of the Ghazwat which he fought. The lot fell on me and so I proceeded with Allah's Apostle after Allah's order of veiling (the women) had been revealed. I was carried (on the back of a camel) in my howdah and carried down while still in it (when we came to a halt). So we went on till Allah's Apostle had finished from that Ghazwa of his and returned. When we approached the city of Medina he announced at night that it was time for departure. So when they announced the news of departure, I got up and went away from the army camps, and after finishing from the call of nature, I came back to my riding animal. I touched my chest to find that my necklace which was made of Zifar beads (i.e. Yemenite beads partly black and partly white) was missing. So I returned to look for my necklace and my search for it detained me. (In the meanwhile) the people who used to carry me on my camel, came and took my howdah and put it on the back of my camel on which I used to ride, as they considered that I was in it. In those days women were light in weight for they did not get fat, and flesh did not cover their bodies in abundance as they used to eat only a little food. Those people therefore, disregarded the lightness of the howdah while lifting and carrying it; and at that time I was still a young girl. They made the camel rise and all of them left (along with it). I found my necklace after the army had gone. Then I came to their camping place to find no call maker of them, nor one who would respond to the call. So I intended to go to the place where I used to stay, thinking that they would miss me and come back to me (in my search). While I was sitting in my resting place, I was overwhelmed by sleep and slept. Safwan bin Al-Muattal As-Sulami Adh-Dhakwani was behind the army. When he reached my place in the morning, he saw the figure of a sleeping person and he recognized me on seeing me as he had seen me before the order of compulsory veiling (was prescribed). So I woke up when he recited Istirja' (i.e. ""Inna li l-lahi wa inna llaihi raji'un"") as soon as he recognized me. I veiled my face with my head cover at once, and by Allah, we did not speak a single word, and I did not hear him saying any word besides his Istirja'. He dismounted from his camel and made it kneel down, putting his leg on its front legs and then I got up and rode on it. Then he set out leading the camel that was carrying me till we overtook the army in the extreme heat of midday while they were at a halt (taking a rest). (Because of the event) some people brought destruction upon themselves and the one who spread the Ifk (i.e. slander) more, was `Abdullah bin Ubai Ibn Salul."" (Urwa said, ""The people propagated the slander and talked about it in his (i.e. `Abdullah's) presence and he confirmed it and listened to it and asked about it to let it prevail."" `Urwa also added, ""None was mentioned as members of the slanderous group besides (`Abdullah) except Hassan bin Thabit and Mistah bin Uthatha and Hamna bint Jahsh along with others about whom I have no knowledge, but they were a group as Allah said. It is said that the one who carried most of the slander was `Abdullah bin Ubai bin Salul."" `Urwa added, ""`Aisha disliked to have Hassan abused in her presence and she used to say, 'It was he who said: My father and his (i.e. my father's) father and my honor are all for the protection of Muhammad's honor from you.""). `Aisha added, ""After we returned to Medina, I became ill for a month. The people were propagating the forged statements of the slanderers while I was unaware of anything of all that, but I felt that in my present ailment, I was not receiving the same kindness from Allah's Apostle as I used to receive when I got sick. (But now) Allah's Apostle would only come, greet me and say,' How is that (lady)?' and leave. That roused my doubts, but I did not discover the evil (i.e. slander) till I went out after my convalescence, I went out with Um Mistah to Al-Manasi' where we used to answer the call of nature and we used not to go out (to answer the call of nature) except at night, and that was before we had latrines near our houses. And this habit of our concerning evacuating the bowels, was similar to the habits of the old 'Arabs living in the deserts, for it would be troublesome for us to take latrines near our houses. So I and Um Mistah who was the daughter of Abu Ruhm bin Al-Muttalib bin `Abd Manaf, whose mother was the daughter of Sakhr bin 'Amir and the aunt of Abu Bakr As-Siddiq and whose son was Mistah bin Uthatha bin `Abbas bin Al-Muttalib, went out. I and Um Mistah returned to my house after we finished answering the call of nature. Um Mistah stumbled by getting her foot entangled in her covering sheet and on that she said, 'Let Mistah be ruined!' I said, 'What a hard word you have said. Do you abuse a man who took part in the battle of Badr?' On that she said, 'O you Hantah! Didn't you hear what he (i.e. Mistah) said? 'I said, 'What did he say?' Then she told me the slander of the people of Ifk. So my ailment was aggravated, and when I reached my home, Allah's Apostle came to me, and after greeting me, said, 'How is that (lady)?' I said, 'Will you allow me to go to my parents?' as I wanted to be sure about the news through them. Allah's Apostle allowed me (and I went to my parents) and asked my mother, 'O mother! What are the people talking about?' She said, 'O my daughter! Don't worry, for scarcely is there a charming woman who is loved by her husband and whose husband has other wives besides herself that they (i.e. women) would find faults with her.' I said, 'Subhan-Allah! (I testify the uniqueness of Allah). Are the people really talking in this way?' I kept on weeping that night till dawn I could neither stop weeping nor sleep then in the morning again, I kept on weeping. When the Divine Inspiration was delayed. Allah's Apostle called `Ali bin Abi Talib and Usama bin Zaid to ask and consult them about divorcing me. Usama bin Zaid said what he knew of my innocence, and the respect he preserved in himself for me. Usama said, '(O Allah's Apostle!) She is your wife and we do not know anything except good about her.' `Ali bin Abi Talib said, 'O Allah's Apostle! Allah does not put you in difficulty and there are plenty of women other than she, yet, ask the maid-servant who will tell you the truth.' On that Allah's Apostle called Barira (i.e. the maid-servant) and said, 'O Barira! Did you ever see anything which aroused your suspicion?' Barira said to him, 'By Him Who has sent you with the Truth. I have never seen anything in her (i.e. Aisha) which I would conceal, except that she is a young girl who sleeps leaving the dough of her family exposed so that the domestic goats come and eat it.' So, on that day, Allah's Apostle got up on the pulpit and complained about `Abdullah bin Ubai (bin Salul) before his companions, saying, 'O you Muslims! Who will relieve me from that man who has hurt me with his evil statement about my family? By Allah, I know nothing except good about my family and they have blamed a man about whom I know nothing except good and he used never to enter my home except with me.' Sa`d bin Mu`adh the brother of Banu `Abd Al-Ashhal got up and said, 'O Allah's Apostle! I will relieve you from him; if he is from the tribe of Al-Aus, then I will chop his head off, and if he is from our brothers, i.e. Al-Khazraj, then order us, and we will fulfill your order.' On that, a man from Al-Khazraj got up. Um Hassan, his cousin, was from his branch tribe, and he was Sa`d bin Ubada, chief of Al-Khazraj. Before this incident, he was a pious man, but his love for his tribe goaded him into saying to Sa`d (bin Mu`adh). 'By Allah, you have told a lie; you shall not and cannot kill him. If he belonged to your people, you would not wish him to be killed.' On that, Usaid bin Hudair who was the cousin of Sa`d (bin Mu`adh) got up and said to Sa`d bin 'Ubada, 'By Allah! You are a liar! We will surely kill him, and you are a hypocrite arguing on the behalf of hypocrites.' On this, the two tribes of Al-Aus and Al Khazraj got so much excited that they were about to fight while Allah's Apostle was standing on the pulpit. Allah's Apostle kept on quietening them till they became silent and so did he. All that day I kept on weeping with my tears never ceasing, and I could never sleep. In the morning my parents were with me and I wept for two nights and a day with my tears never ceasing and I could never sleep till I thought that my liver would burst from weeping. So, while my parents were sitting with me and I was weeping, an Ansari woman asked me to grant her admittance. I allowed her to come in, and when she came in, she sat down and started weeping with me. While we were in this state, Allah's Apostle came, greeted us and sat down. He had never sat with me since that day of the slander. A month had elapsed and no Divine Inspiration came to him about my case. Allah's Apostle then recited Tashah-hud and then said, 'Amma Badu, O `Aisha! I have been informed so-andso about you; if you are innocent, then soon Allah will reveal your innocence, and if you have committed a sin, then repent to Allah and ask Him for forgiveness for when a slave confesses his sins and asks Allah for forgiveness, Allah accepts his repentance.' (continued...) (continuing... 1): -5.462:... ... When Allah's Apostle finished his speech, my tears ceased flowing completely that I no longer felt a single drop of tear flowing. I said to my father, 'Reply to Allah's Apostle on my behalf concerning what he has said.' My father said, 'By Allah, I do not know what to say to Allah's Apostle .' Then I said to my mother, 'Reply to Allah's Apostle on my behalf concerning what he has said.' She said, 'By Allah, I do not know what to say to Allah's Apostle.' In spite of the fact that I was a young girl and had a little knowledge of Qur'an, I said, 'By Allah, no doubt I know that you heard this (slanderous) speech so that it has been planted in your hearts (i.e. minds) and you have taken it as a truth. Now if I tell you that I am innocent, you will not believe me, and if confess to you about it, and Allah knows that I am innocent, you will surely believe me. By Allah, I find no similitude for me and you except that of Joseph's father when he said, '(For me) patience in the most fitting against that which you assert; it is Allah (Alone) Whose Help can be sought.' Then I turned to the other side and lay on my bed; and Allah knew then that I was innocent and hoped that Allah would reveal my innocence. But, by Allah, I never thought that Allah would reveal about my case, Divine Inspiration, that would be recited (forever) as I considered myself too unworthy to be talked of by Allah with something of my concern, but I hoped that Allah's Apostle might have a dream in which Allah would prove my innocence. But, by Allah, before Allah's Apostle left his seat and before any of the household left, the Divine inspiration came to Allah's Apostle. So there overtook him the same hard condition which used to overtake him, (when he used to be inspired Divinely). The sweat was dropping from his body like pearls though it was a wintry day and that was because of the weighty statement which was being revealed to him. When that state of Allah's Apostle was over, he got up smiling, and the first word he said was, 'O `Aisha! Allah has declared your innocence!' Then my Mother said to me, 'Get up and go to him (i.e. Allah's Apostle). I replied, 'By Allah, I will not go to him, and I praise none but Allah. So Allah revealed the ten Verses:- - ""Verily! They who spread the slander Are a gang, among you............."" (24.11-20) Allah revealed those Qur'anic Verses to declare my innocence. Abu Bakr As-Siddiq who used to disburse money for Mistah bin Uthatha because of his relationship to him and his poverty, said, 'By Allah, I will never give to Mistah bin Uthatha anything after what he has said about Aisha.' Then Allah revealed:-- ""And let not those among you who are good and wealthy swear not to give (any sort of help) to their kinsmen, those in need, and those who have left their homes for Allah's cause, let them pardon and forgive. Do you not love that Allah should forgive you? And Allah is oft-Forgiving Most Merciful."" (24.22) Abu Bakr As-Siddiq said, 'Yes, by Allah, I would like that Allah forgive me.' and went on giving Mistah the money he used to give him before. He also added, 'By Allah, I will never deprive him of it at all.' Aisha further said:."" Allah's Apostle also asked Zainab bint Jahsh (i.e. his wife) about my case. He said to Zainab, 'What do you know and what did you see?"" She replied, ""O Allah's Apostle! I refrain from claiming falsely that I have heard or seen anything. By Allah, I know nothing except good (about `Aisha).' From amongst the wives of the Prophet Zainab was my peer (in beauty and in the love she received from the Prophet) but Allah saved her from that evil because of her piety. Her sister Hamna, started struggling on her behalf and she was destroyed along with those who were destroyed. The man who was blamed said, 'Subhan-Allah! By Him in Whose Hand my soul is, I have never uncovered the cover (i.e. veil) of any female.' Later on the man was martyred in Allah's Cause."""
