,Pillar,Type,Text
8,Shahada,Hadith," Sa, id b. jubair reported that it was said to Ibn 'Abbas that Nauf al-Bikali was of the opinion that Moses who went in search of knowledge was not the Moses of Bani Isra'il. He said:                      Sa'id, did you hear it from him? I said: Yes. Thereupon he said that Nauf had not stated the fact. Ubayy b. Ka'b narrated to us that he had heard Allah's Messenger (may peace be upon him) as saying: Moses had been delivering sermons to his people. And he made this remark: No person upon the earth has better knowledge than I or nothing better than mine. Thereupon Allah revealed to him: I know one who is better than you (in knowledge) or there is a person on the earth having more knowledge than you. Thereupon he said: My Lord, direct me to him. It was said to him: Keep a salted fish as a provision for journey. The place where that fish would be lost (there you will find that man). So he set forth and a young slave along with him until they came to a place Sakhra. but he did not find any clue. So he proceeded on and left that young man there. The fish began to stir in water and the water assumed the form of an ark over the fish. The young man said: I should meet Allah's Apostle (peace be upon him) and inform him, but he was made to forget and when they had gone beyond that place, he (Moses) said to the young man: Bring breakfast. We have been exhausted because of the journey, and he (Moses) was not exhausted until he had crossed that (particular) place (where he had) to meet Khadir, and the youth was reminded and said: Did you not see that as we reached Sakhra I forgot the fish and it is satan alone who has made me forgetful of it'? It is strange that he has been able to find way in the ocean too. He said: This is what we sought for us. They returned retracing their steps, and he (his companion) pointed to him the location (where) the fish (had been lost). Moses began to search him there. He suddenly saw Khadir wrapped in a cloth and lying on his back. He said to him: As-Salamu-'Alaikum. He removed the cloth from his face and said: Wa 'Alaikum-us-Salam! Who are you? He said: I am Moses. He said: Who Moses? He said: Moses Of Bani Isra'il. He said: What brought you here? He said: I have come so that you may teach me what you have been taught of righteousness. He said: You shall have to bear with me, and how can you have patience about a thing of which you have no comprehensive knowledge? You will not have patience when you see me doing a thing I have been ordered to do. He said: If Allah pleases, you will find me patient, nor shall I disobey you in aught. Khadir said: If you follow me, don't ask me about anything until I explain it to you. So they went on until they embarked upon a boat. He (Khadir) made a hole in that. Thereupon he (Moses) said: You have done this so that you may drown the persons sitting in the boat. You have done something grievous. Thereupon he said: Did I not tell you that you will not be able to bear with me? Thereupon he (Moses) said: Blame me not for what I forgot and be not hard upon me for what I did. (Khadir gave him another chance.) So they went on until they reached a place where boys were playing. He went to one of them and caught hold'of one (apparently) at random and killed him. Moses (peace be upon him) felt agitated and said: You have killed an innocent person not guilty of slaying another. You have done something aboininable. Thereupon Allah's Messenger (may peace be upon him) said: May Allah have mercy upon us and Moses. Had he shown patience he would have seen wonderful things, but fear of blame, with respect to his companion, seized him and he said: If I ask anything after this, keep not company with me. You will then have a valid excuse in my case, and had he (Moses) shown patience he would have seen many wonderful things. He (the narrator) said: Whenever he (the Holy Prophet) made mention of any Prophet, he always said: May there be mercy of Allah upon us and upon my brother so and so. They, however, proceeded on until they came to the inhabitants of a village who were very miserly. They went to the meeting places and asked for hospitality but they refused to show any hospitality to them. They both found in that village a wall which was about to fall. He (Khadir) set it right. Thereupon he (Moses) said: If you so liked. you could get wages for it. Thereupon he said: This is the partince, of ways between me and you, and, taking hold of his cloth, he said: Now I will explain to you the real significance (of all these acts) for which you could not show patience. As for the boat, it belonged to the poor people working on the river and I intended to damage it for there was ahead of them (a king) who seized boats by force. (When he came) to catch hold of it he found it a damaged boat, so he spared it (and later on) it was set right with wood. So far as the boy is concerned, he has been, by very nature, an unbeliever, whereas his parents loved him very much. Had he grown up he would have involved them in wrongdoing and unbelief, so we wished that their Lord should give them in its place one better in purity and close to mercy. And as for the wall it belonged to two orphan boys in the city and there was beneath it a (treasure) belongin to them,... up to the last verse. This hadith has been transmitted on the authority of Abu Ishaq."
9,Shahada,Hadith," Narrated 'Aishah:                     ""What was said about me had been said, and I myself was unaware of it, the Messenger of Allah () got up and addressed the people. He recited the Tashahhud and after praising and expressing gratitude to Allah, as He deserved, he said: 'To proceed: O people! Give me your opinion regarding those people who made a forged story against my wife. By Allah, I do not know anything bad about her at all. By Allah, they accused her of being with a man about whom I have never known anything bad, and he never entered my house unless I was present there, and whenever I went on a journey, he went with me.' Sa'd bin Mu'adh [may Allah be pleased with him] got up and said: 'O Messenger of Allah ()! Allow me to chop their heads off!' Then a man from Al-Khazraj, to whom the mother of Hassan bin Thabit was a relative, got up and said (to Sa'd): 'You have told a lie! By Allah, if those persons were from Al-Aws, you would not like to chop their heads.' It was probable that some evil would take place between Aws and Khazraj in the Masjid while I was unaware of that. In the evening of that day, I went out for some of my needs, and Umm Mistah was accompanying me. On our return, Umm Mistah stumbled and said: 'Let Mistah be ruined!' I said to her, 'O mother! Why do you abuse your son?' On that Umm Mistah became silent for a while, and stumbling again, she said: 'Let Mistah be ruined!' I said to her: 'O mother! Why do you abuse your son?' She stumbled for the third time and said: 'Let Mistah be ruined!' I said to her: 'O mother! Why do you abuse your son?' Upon that she said: 'By Allah! I do not abuse him except because of you.' I asked her: 'Concerning what of my affairs?' So she disclosed the whole story to me. I said: 'Has this really happened?' She replied: 'Yes, by Allah!' I returned to my house, so astonished, that I did not know for what purpose I had gone out. Then I became sick and said to the Messenger of Allah () 'Send me to my father's house.' So he sent a servant with me, and when I entered the house, I found Umm Ruman downstairs, while Abu Bakr was reciting something upstairs. My mother asked: 'What has brought you, O daughter?' She said: ""I informed her and mentioned the whole story to her, but she did not feel as I did about it. She said: 'O my daughter! Do not worry much about this matter, for there is never a charming lady loved by her husband who has other wives, but that they feel jealous of her and speak badly of her.' But she did not feel the same about it as I did. I asked her: 'Does my father know about it?' She said 'Yes.' I asked: 'Does the Messenger of Allah () know about it too?' She said 'Yes, the Messenger of Allah () also knows about it.' Tears filled my eyes and I wept. Abu Bakr, who was reading upstairs, heard my voice, and came down asking my mother: 'What is the matter with her?' She said: 'She has heard what has been said about her.' On that Abu Bakr wept and said: 'I beseech you, by Allah, O my daughter, to go back to your home.' I went back to my home, and the Messenger of Allah () had come to my house asking my maid-servant about me. The maid-servant said: 'By Allah! I do not know of any fault or defect in her character except that she sleeps and lets the sheep enter and eat her dough.' On that, some of the Prophet's Companions spoke harshly to her and said: 'Tell the truth to the Messenger of Allah ().' Finally, they told her of the slander and she said: 'Subhan Allah! By Allah, I know nothing against her except what a goldsmith knows about a piece of pure gold.' Then this news reached the man who was accused, and he said: 'Subhan Allah! By Allah, I have never uncovered the private parts of any woman.' Later, that man was martyred in Allah's Cause. Then the next morning, my parents came to pay me a visit and they stayed with me until the Messenger of Allah () came to me, after he performed the 'Asr prayer. He came to me and while my parents were sitting around me on my right and my left. The Prophet () said the Tashahhud, praised and glorified Allah and said: 'Now then, O 'Aishah! If you have committed a bad deed, or you have wronged (yourself), then repent to Allah, as Allah accepts the repentance from His worshipers.' An Ansari woman had come and was sitting near the gate. I said to the Prophet (): 'Isn't it improper that you speak in such a way in the presence of this lady?' The Messenger of Allah () then gave a piece of advice and I turned to my father and requested him to reply to him. My father said: 'What should I say?' Then I turned to my mother and asked her to answer him. She said: 'What should I say?' When my parents did not reply to the Prophet (), I said the Tashahhud, praised and glorified Allah as His due, and I said: 'Then, by Allah! If I were to tell you that I have not done (this) and Allah, the Mighty and Sublime, is witness that I am telling the truth, that would not be of any use to me on your part, because you (people) have spoken about it and your hearts have absorbed it (as truth); and if I were to tell you that I have done this sin, and Allah knows that I have not done it, then you will say: 'She has confessed her guilt.' By Allah! I do not see a suitable example for me and you except the example of - and I could not remember Ya'qbus name - Yusuf's father when he said: So patience is most fitting. And it is Allah Whose help can be sought against that which you describe (12:18). She said: ""It was at that time that Revelation came to the Messenger of Allah (), and we remained silent. Then the Revelation was over, and I noticed the signs of happiness on his face while he was wiping (the sweat) from his forehead, and saying: 'Have the good tidings O 'Aishah! Allah has revealed your innocence.' At that time I was extremely angry. My parents said to me: 'Get up and go to him.' I said: 'By Allah, I will not do it,and will not thank him nor either of you, but I will thank Allah, Who has revealed my innocence. You have heard (this story) but neither of you have denied it, nor have you changed it (to defend me).'"" 'Aishah used to say: ""But as regards to Zainab bint Jahsh, Allah protected her because of her piety. She did not say anything except good (about me). But her sister, Hamnah was ruined among those who were ruined. Those who used to speak evil about me were Mistah, Hassan bin Thabit, and the hypocrite 'Abdullah bin Ubayy [bin Salul] and [it is he who] used to spread that news and tempt others to speak of it, and it was he and Hamnah who had the greater share therein. Abu Bakr took an oath that he would never do any favor for Mistah at all. Then Allah, Most High, revealed this Ayah: 'Let not those among you who are blessed with graces and wealth' [until the end of the Ayah] referring to Abu Bakr: 'to give their kinsmen, the poor, and those who left their homes for Allah's Cause.' - meaning Mistah - up to His saying: Do you not love that Allah should forgive you? And Allah is Oft-Forgiving, Most Merciful (24:22).' On that, Abu Bakr said: 'Yes, by Allah! O our Lord! We wish that You forgive us.' So he returned to what he had been doing."""
10,Shahada,Hadith," Abu Malik Al-Ashari narrated that the Messenger of Allah said:                     Al-Wudu is half of faith, and All praise is due to Allah (Al-Hamdulillah) fills the Scale, and Glory is to Allah and all praise is to Allah (Subhan Allah Wal-Hamdulillah) fill - or - fills what is between the heavens and the earth, and Salat is light and charity is an evidence, and patience is an illumination, and the Quran is a proof for you or against you. And all people shall come to the morning selling their souls, either setting it free or destroying it."
11,Shahada,Hadith," A man from Banu Sulaim narrated:                     The Messenger of Allah counted them out in my hand - or - in his hand: At-Tasbih is half of the Scale, and All praise is due to Allah (Al-Hamdulillah) fills it, and At-Takbir (Allahu Akbar) fills what is between the sky and the earth, and fasting is half of patience, and purification is half of faith."
12,Shahada,Hadith," Narrated Ibn 'Umar:                     said that a freed a slave girl of his came to him, and said: ""Times have become hard on me and I want to go to Al-'Iraq."" He said: ""Why not to Ash-Sham the land of the resurrection? Have patience you foolish lady; I heard the Messenger of Allah () say: 'Whoever endures its hardships and difficulties (Al-Madinah) then I will be a witness, or an intercessor for him on the Day of Judgement.""[He said:] There are narrations on this topic from Abu Sa'eed, Sufyan bin Abi Zuhair, and Subai'ah Al-Aslamiyyah."
13,Shahada,Hadith," It was narrated from 'Abdur-Rahman bin Ghanm that Abu Malik Al-Ash'ari told him that the Messenger of Allah said:                     ""Isbagh Al-Wudu is half of faith; Alhamdu lillah (praise be to Allah) fills the balance; the Tasbih and the Takbir fill the heavens and Earth; the Salah is light; the Zakah is a sign (of sincerity); patience is an illuminating torch; and the Qur'an is proof, either for you or against you."""
14,Shahada,Hadith," It was narrated from Abu Malik Ash'ari that:                     The Messenger of Allah said: ""Performing ablution properly is half of faith, saying Al-Hamdu Lillah fills the Scale (of good deeds), saying Subhan-Allah and Allahu Akbar fills the heavens and the earth, prayer is light, Zakat is proof, patience is brightness and the Qur'an is proof for you or against you. Every person goes out in the morning to sell his soul, so he either frees it or destroys it.'"""
15,Salat,Hadith," Narrated An-Nazzal bin Sabra:                     `Ali offered the Zuhr prayer and then sat down in the wide courtyard (of the Mosque) of Kufa in order to deal with the affairs of the people till the `Asr prayer became due. Then water was brought to him and he drank of it, washed his face, hands, head and feet. Then he stood up and drank the remaining water while he was standing. and said, ""Some people dislike to drink water while standing thought the Prophet did as I have just done."""
16,Salat,Hadith," Narrated Um Atiyya:                     We gave the Pledge of allegiance to the Prophet and he recited to me the verse (60.12). That they will not associate anything in worship with Allah (60.12). And he also prevented us from wailing and lamenting over the dead. A woman from us held her hand out and said, ""Such-and-such a woman cried over a dead person belonging to my family and I want to compensate her for that crying"" The Prophet did not say anything in reply and she left and returned. None of those women abided by her pledge except Um Sulaim, Um Al-`Ala', and the daughter of Abi Sabra, the wife of Al-Mu`adh or the daughter of Abi Sabra, and the wife of Mu`adh."
17,Salat,Hadith," Yazid b. Hayyan reported, I went along with Husain b. Sabra and 'Umar b. Muslim to Zaid b. Arqam and, as we sat by his side, Husain said to him:                      Zaid. you have been able to acquire a great virtue that you saw Allah's Messenger (may peace be upon him) listened to his talk, fought by his side in (different) battles, offered prayer behind me. Zaid, you have in fact earned a great virtue. Zaid, narrate to us what you heard from Allah's Messenger (may peace be upon him). He said: I have grown old and have almost spent my age and I have forgotten some of the things which I remembered in connection with Allah's Messenger (may peace be upon him), so accept whatever I narrate to you, and which I do not narrate do not compel me to do that. He then said: One day Allah's Messenger (may peace be upon him) stood up to deliver sermon at a watering place known as Khumm situated between Mecca and Medina. He praised Allah, extolled Him and delivered the sermon and. exhorted (us) and said: Now to our purpose. O people, I am a human being. I am about to receive a messenger (the angel of death) from my Lord and I, in response to Allah's call, (would bid good-bye to you), but I am leaving among you two weighty things: the one being the Book of Allah in which there is right guidance and light, so hold fast to the Book of Allah and adhere to it. He exhorted (us) (to hold fast) to the Book of Allah and then said: The second are the members of my household I remind you (of your duties) to the members of my family. He (Husain) said to Zaid: Who are the members of his household? Aren't his wives the members of his family? Thereupon he said: His wives are the members of his family (but here) the members of his family are those for whom acceptance of Zakat is forbidden. And he said: Who are they? Thereupon he said: 'Ali and the offspring of 'Ali, 'Aqil and the offspring of 'Aqil and the offspring of Ja'far and the offspring of 'Abbas. Husain said: These are those for whom the acceptance of Zakat is forbidden. Zaid said: Yes."
18,Salat,Hadith," (Sabrah bin Ma'bad al-Juhni) narrated that:                     Allah's Messenger (S) said: ""Teach the boy Salat when he is seven years old, and beat him (if he does not pray) when he is ten."""
19,Salat,Hadith," 'Abdul-Malik bin Rabi' bin Sabrah bin Ma'bad Al-Juhani said:                     ""My father told me, from his father that the Messenger of Allah said: 'Do not perform prayer in the camels' resting-places, and perform prayer in the sheep's resting-places.'"""
20,Salat,Hadith," Narrated Aisha:                     When there was said about me what was said which I myself was unaware of, Allah's Apostle got up and addressed the people. He recited Tashah-hud, and after glorifying and praising Allah as He deserved, he said, ""To proceed: O people Give me your opinion regarding those people who made a forged story against my wife. By Allah, I do not know anything bad about her. By Allah, they accused her of being with a man about whom I have never known anything bad, and he never entered my house unless I was present there, and whenever I went on a journey, he went with me."" Sa`d bin Mu`adh got up and said, ""O Allah's Apostle Allow me to chop their heads off"". Then a man from the Al-Khazraj (Sa`d bin 'Ubada) to whom the mother of (the poet) Hassan bin Thabit was a relative, got up and said (to Sa`d bin Mu`adh), ""You have told a lie! By Allah, if those persons were from the Aus Tribe, you would not like to chop their heads off."" It was probable that some evil would take place between the Aus and the Khazraj in the mosque, and I was unaware of all that. In the evening of that day, I went out for some of my needs (i.e. to relieve myself), and Um Mistah was accompanying me. On our return, Um Mistah stumbled and said, ""Let Mistah. be ruined"" I said to her, ""O mother Why do you abuse your Son"" On that Um Mistah became silent for a while, and stumbling again, she said, ""Let Mistah be ruined"" I said to her, ""Why do you abuse your son?"" She stumbled for the third time and said, ""Let Mistah be ruined"" whereupon I rebuked her for that. She said, ""By Allah, I do not abuse him except because of you."" I asked her, ""Concerning what of my affairs?"" So she disclosed the whole story to me. I said, ""Has this really happened?"" She replied, ""Yes, by Allah."" I returned to my house, astonished (and distressed) that I did not know for what purpose I had gone out. Then I became sick (fever) and said to Allah's Apostle ""Send me to my father's house."" So he sent a slave with me, and when I entered the house, I found Um Rum-an (my mother) downstairs while (my father) Abu Bakr was reciting something upstairs. My mother asked, ""What has brought you, O (my) daughter?"" I informed her and mentioned to her the whole story, but she did not feel it as I did. She said, ""O my daughter! Take it easy, for there is never a charming lady loved by her husband who has other wives but that they feel jealous of her and speak badly of her."" But she did not feel the news as I did. I asked (her), ""Does my father know about it?"" She said, ""yes"" I asked, Does Allah's Apostle know about it too?"" She said, ""Yes, Allah's Apostle does too."" So the tears filled my eyes and I wept. Abu Bakr, who was reading upstairs heard my voice and came down and asked my mother, ""What is the matter with her? "" She said, ""She has heard what has been said about her (as regards the story of Al-lfk)."" On that Abu- Bakr wept and said, ""I beseech you by Allah, O my daughter, to go back to your home"". I went back to my home and Allah's Apostle had come to my house and asked my maid-servant about me (my character). The maid-servant said, ""By Allah, I do not know of any defect in her character except that she sleeps and let the sheep enter (her house) and eat her dough."" On that, some of the Prophet's companions spoke harshly to her and said, ""Tell the truth to Allah's Apostle."" Finally they told her of the affair (of the slander). She said, ""Subhan Allah! By Allah, I know nothing against her except what goldsmith knows about a piece of pure gold."" Then this news reached the man who was accused, and he said, ""Subhan Allah! By Allah, I have never uncovered the private parts of any woman."" Later that man was martyred in Allah's Cause. Next morning my parents came to pay me a visit and they stayed with me till Allah's Apostle came to me after he had offered the `Asr prayer. He came to me while my parents were sitting around me on my right and my left. He praised and glorified Allah and said, ""Now then O `Aisha! If you have committed a bad deed or you have wronged (yourself), then repent to Allah as Allah accepts the repentance from his slaves."" An Al-Ansari woman had come and was sitting near the gate. I said (to the Prophet). ""Isn't it improper that you speak in such a way in the presence of this lady? Allah's Apostle then gave a piece of advice and I turned to my father and requested him to answer him (on my behalf). My father said, ""What should I say?"" Then I turned to my mother and asked her to answer him. She said, ""What should I say?"" When my parents did not give a reply to the Prophet, I said, ""I testify that none has the right to be worshipped except Allah, and that Muhammad is His Apostle!"" And after praising and glorifying Allah as He deserves, I said, ""Now then, by Allah, if I were to tell you that I have not done (this evil action) and Allah is a witness that I am telling the truth, that would not be of any use to me on your part because you (people) have spoken about it and your hearts have absorbed it; and if I were to tell you that I have done this sin and Allah knows that I have not done it, then you will say, 'She has confessed herself guilty."" By Allah, 'I do not see a suitable example for me and you but the example of (I tried to remember Jacob's name but couldn't) Joseph's father when he said; So (for me) ""Patience is most fitting against that which you assert. It is Allah (alone) whose help can be sought.' At that very hour the Divine Inspiration came to Allah's Apostle and we remained silent. Then the Inspiration was over and I noticed the signs of happiness on his face while he was removing (the sweat) from his forehead and saying, ""Have the good tidings O ' ""Aisha! Allah has revealed your innocence."" At that time I was extremely angry. My parents said to me. ""Get up and go to him."" I said, ""By Allah, I will not do it and will not thank him nor thank either of you, but I will thank Allah Who has revealed my innocence. You have heard this story but neither did not deny it nor change it (to defend me),"" (Aisha used to say:) ""But as regards Zainab bint Jahsh, (the Prophet's wife), Allah protected her because of her piety, so she did not say anything except good (about me), but her sister, Hamna, was ruined among those who were ruined. Those who used to speak evil about me were Mistah, Hassan bin Thabit, and the hypocrite, `Abdullah bin Ubai, who used to spread that news and tempt others to speak of it, and it was he and Hamna who had the greater share therein. Abu Bakr took an oath that he would never do any favor to Mistah at all. Then Allah revealed the Divine Verse: ""Let not those among you who are good and wealthy (i.e. Abu Bakr) swear not to give (any sort of help) to their kinsmen, and those in need, (i.e. Mistah) ...Do you not love that Allah should forgive you? And Allah is Oft-Forgiving, Most Merciful."" (24.22) On that, Abu Bakr said, ""Yes, by Allah, O our Lord! We wish that You should forgive us."" So Abu Bakr again started giving to Mistah the expenditure which he used to give him before."
